{
  "id": "google_maps_geocode",
  "name": "Google Maps Geocode",
  "owner_agent": "hermes",
  "execution_location": "both",
  "default_model": "none",
  "autonomy_ring": 0,
  "tools": ["terminal", "network:google_maps"],
  "credentials": ["GOOGLE_MAPS_API_KEY"],
  "max_daily_cost_usd": 0,
  "inputs": [
    "address (endereço em texto livre)",
    "OU lat/lng (geocodificação reversa)"
  ],
  "outputs": [
    "formatted_address",
    "lat/lng",
    "place_id",
    "componentes de endereço (cidade, estado, cep, país)"
  ],
  "stop_conditions": [
    "leitura pura (GET), sem nenhuma ação de escrita possível nesta skill",
    "sem endereço nem lat/lng válido -> erro claro, nunca inventa coordenada",
    "resposta da API com status != OK/ZERO_RESULTS -> erro claro com o status devolvido, nunca mascarado como sucesso vazio"
  ],
  "telemetry_events": [
    "google_maps_geocode.lookup.executed",
    "google_maps_geocode.lookup.failed"
  ],
  "enabled": false,
  "production_ready": false,
  "activation_stage": "staging",
  "notes": "staging: construída pra dar ao Alfred Kings (cliente Gabriel Kingsbury/Ecoloop) contexto de localização em consultas imobiliárias — geocodifica endereço pra lat/lng (entrada de outras skills como attom-property/rentcast-estimate) ou o inverso. Anel 0 (leitura pura, sem custo de LLM) por ser determinística e sem ação externa. GOOGLE_MAPS_API_KEY é a própria chave do Gabriel (Doppler dele, projeto alfred-kings-ai), nunca a da Axtro."
}
